{
  "bundle_id": "kg-publication:ecocheck:v1",
  "audience": "ecocheck",
  "version": "v1",
  "generated_at": "2026-06-22",
  "approval_basis": "ETO_APPROVED_IN_GRAPH",
  "human_review_required": false,
  "machine_gate_status": "partial",
  "inputs": [
    "data/knowledge-governance/doc-registry/knowledge-documents.json",
    "data/knowledge-governance/candidates/governance-candidates.json"
  ],
  "items": [
    {
      "item_id": "kg-pub-item:kg-doc-std-GB-12348-2008",
      "doc_id": "kg-doc:std-GB-12348-2008",
      "title": "工业企业厂界环境噪声排放标准(GB 12348-2008)",
      "doc_type": "technical_standard",
      "rag_doc_ref": "tencent-lke://eco-kb/PDS-V8_0-0003",
      "source_ref": "tech-spec:eco-kb:PDS-V8_0-0003",
      "legal_basis_status": "internal_reviewed",
      "review_status": "approved",
      "citation_locator": "GB 12348-2008",
      "locator_level": "spec_or_section",
      "source_hash": "098e87129239595e950da7e4e2dedf1bc5601d7b2f4e277b4ecd7a68b3d620b7",
      "cache_policy": "metadata_only",
      "raw_cached": false,
      "trace": {
        "source_report": "reports/rag-citation-resolution-report.json",
        "node_ids": [
          "tech-spec:eco-kb:PDS-V8_0-0003"
        ],
        "rag_doc_refs": [
          "tencent-lke://eco-kb/PDS-V8_0-0003"
        ]
      }
    },
    {
      "item_id": "kg-pub-item:kg-doc-std-GB-12711-2018",
      "doc_id": "kg-doc:std-GB-12711-2018",
      "title": "低、中水平放射性固体废物包安全标准(GB 12711-2018代替GB 12711-1991)",
      "doc_type": "technical_standard",
      "rag_doc_ref": "tencent-lke://eco-kb/PDS-V8_0-0191",
      "source_ref": "tech-spec:eco-kb:PDS-V8_0-0191",
      "legal_basis_status": "internal_reviewed",
      "review_status": "approved",
      "citation_locator": "GB 12711-2018",
      "locator_level": "spec_or_section",
      "source_hash": "79d6212dc008547535a54ee219c95823bdc7e1167784fdfc9cfe68e2efed8cd0",
      "cache_policy": "metadata_only",
      "raw_cached": false,
      "trace": {
        "source_report": "reports/rag-citation-resolution-report.json",
        "node_ids": [
          "tech-spec:eco-kb:PDS-V8_0-0191"
        ],
        "rag_doc_refs": [
          "tencent-lke://eco-kb/PDS-V8_0-0191"
        ]
      }
    },
    {
      "item_id": "kg-pub-item:kg-doc-std-GB-13456-2012",
      "doc_id": "kg-doc:std-GB-13456-2012",
      "title": "《钢铁工业水污染物排放标准》(GB 13456-2012)修改单",
      "doc_type": "technical_standard",
      "rag_doc_ref": "tencent-lke://eco-kb/PDS-V8_0-0046",
      "source_ref": "tech-spec:eco-kb:PDS-V8_0-0046",
      "legal_basis_status": "internal_reviewed",
      "review_status": "approved",
      "citation_locator": "GB 13456-2012",
      "locator_level": "spec_or_section",
      "source_hash": "cf367c6d0a046478c4da7c21973292eaeb785a6ec6a8c8afeccf5e9f53288d93",
      "cache_policy": "metadata_only",
      "raw_cached": false,
      "trace": {
        "source_report": "reports/rag-citation-resolution-report.json",
        "node_ids": [
          "tech-spec:eco-kb:PDS-V8_0-0046",
          "tech-spec:eco-kb:PDS-V8_0-0124"
        ],
        "rag_doc_refs": [
          "tencent-lke://eco-kb/PDS-V8_0-0046",
          "tencent-lke://eco-kb/PDS-V8_0-0124"
        ]
      }
    },
    {
      "item_id": "kg-pub-item:kg-doc-std-GB-13457-92",
      "doc_id": "kg-doc:std-GB-13457-92",
      "title": "肉类加工工业水污染物排放标准(GB 13457-92)",
      "doc_type": "technical_standard",
      "rag_doc_ref": "tencent-lke://eco-kb/PDS-V8_0-0114",
      "source_ref": "tech-spec:eco-kb:PDS-V8_0-0114",
      "legal_basis_status": "internal_reviewed",
      "review_status": "approved",
      "citation_locator": "GB 13457-92",
      "locator_level": "spec_or_section",
      "source_hash": "91b551b062e7839ca66bc9cc725865199e7ee98611ead35349b3b8f448a1d3e2",
      "cache_policy": "metadata_only",
      "raw_cached": false,
      "trace": {
        "source_report": "reports/rag-citation-resolution-report.json",
        "node_ids": [
          "tech-spec:eco-kb:PDS-V8_0-0114"
        ],
        "rag_doc_refs": [
          "tencent-lke://eco-kb/PDS-V8_0-0114"
        ]
      }
    },
    {
      "item_id": "kg-pub-item:kg-doc-std-GB-13458-2013",
      "doc_id": "kg-doc:std-GB-13458-2013",
      "title": "合成氨工业水污染物排放标准(GB 13458-2013代替GB 13458-2001)",
      "doc_type": "technical_standard",
      "rag_doc_ref": "tencent-lke://eco-kb/PDS-V8_0-0070",
      "source_ref": "tech-spec:eco-kb:PDS-V8_0-0070",
      "legal_basis_status": "internal_reviewed",
      "review_status": "approved",
      "citation_locator": "GB 13458-2013",
      "locator_level": "spec_or_section",
      "source_hash": "ad3abb5057b8d18b029dd062b357e955f76b5c452ab17ea5c06b4f1eb95f6733",
      "cache_policy": "metadata_only",
      "raw_cached": false,
      "trace": {
        "source_report": "reports/rag-citation-resolution-report.json",
        "node_ids": [
          "tech-spec:eco-kb:PDS-V8_0-0070"
        ],
        "rag_doc_refs": [
          "tencent-lke://eco-kb/PDS-V8_0-0070"
        ]
      }
    },
    {
      "item_id": "kg-pub-item:kg-doc-std-GB-13600-2024",
      "doc_id": "kg-doc:std-GB-13600-2024",
      "title": "放射性固体废物岩洞处置安全规定(GB 13600-2024代替GB 13600-92)",
      "doc_type": "law",
      "rag_doc_ref": "tencent-lke://eco-kb/PDS-V8_0-0198",
      "source_ref": "tech-spec:eco-kb:PDS-V8_0-0198",
      "legal_basis_status": "internal_reviewed",
      "review_status": "approved",
      "citation_locator": "GB 13600-2024",
      "locator_level": "spec_or_section",
      "source_hash": "fb036e700d80445c627a51afacacf7fe9d30d052f18c22caf2dc2763fa609413",
      "cache_policy": "metadata_only",
      "raw_cached": false,
      "trace": {
        "source_report": "reports/rag-citation-resolution-report.json",
        "node_ids": [
          "tech-spec:eco-kb:PDS-V8_0-0198"
        ],
        "rag_doc_refs": [
          "tencent-lke://eco-kb/PDS-V8_0-0198"
        ]
      }
    },
    {
      "item_id": "kg-pub-item:kg-doc-std-GB-14317-93",
      "doc_id": "kg-doc:std-GB-14317-93",
      "title": "核热电厂辐射防护规定(GB 14317-93)",
      "doc_type": "law",
      "rag_doc_ref": "tencent-lke://eco-kb/PDS-V8_0-0205",
      "source_ref": "tech-spec:eco-kb:PDS-V8_0-0205",
      "legal_basis_status": "internal_reviewed",
      "review_status": "approved",
      "citation_locator": "GB 14317-93",
      "locator_level": "spec_or_section",
      "source_hash": "893d7179cd6f606909beceae9c1899700ebead44c7505d11492d974f08a4ba69",
      "cache_policy": "metadata_only",
      "raw_cached": false,
      "trace": {
        "source_report": "reports/rag-citation-resolution-report.json",
        "node_ids": [
          "tech-spec:eco-kb:PDS-V8_0-0205"
        ],
        "rag_doc_refs": [
          "tencent-lke://eco-kb/PDS-V8_0-0205"
        ]
      }
    },
    {
      "item_id": "kg-pub-item:kg-doc-std-GB-14374-93",
      "doc_id": "kg-doc:std-GB-14374-93",
      "title": "航天推进剂水污染物排放与分析方法标准(GB 14374-93)",
      "doc_type": "law",
      "rag_doc_ref": "tencent-lke://eco-kb/PDS-V8_0-0117",
      "source_ref": "tech-spec:eco-kb:PDS-V8_0-0117",
      "legal_basis_status": "internal_reviewed",
      "review_status": "approved",
      "citation_locator": "GB 14374-93",
      "locator_level": "spec_or_section",
      "source_hash": "d50877385270153a78e2778b88206aece3cfa64689f90d93ad7b2351f44396ab",
      "cache_policy": "metadata_only",
      "raw_cached": false,
      "trace": {
        "source_report": "reports/rag-citation-resolution-report.json",
        "node_ids": [
          "tech-spec:eco-kb:PDS-V8_0-0117"
        ],
        "rag_doc_refs": [
          "tencent-lke://eco-kb/PDS-V8_0-0117"
        ]
      }
    },
    {
      "item_id": "kg-pub-item:kg-doc-std-GB-14470-1-2002",
      "doc_id": "kg-doc:std-GB-14470-1-2002",
      "title": "兵器工业水污染物排放标准火炸药(GB 14470.1-2002)",
      "doc_type": "technical_standard",
      "rag_doc_ref": "tencent-lke://eco-kb/PDS-V8_0-0051",
      "source_ref": "tech-spec:eco-kb:PDS-V8_0-0051",
      "legal_basis_status": "internal_reviewed",
      "review_status": "approved",
      "citation_locator": "GB 14470.1-2002",
      "locator_level": "spec_or_section",
      "source_hash": "d25f1812bd5bca010e93554e25153b5b3383d9c50b23a89190aa2e1431ad72ea",
      "cache_policy": "metadata_only",
      "raw_cached": false,
      "trace": {
        "source_report": "reports/rag-citation-resolution-report.json",
        "node_ids": [
          "tech-spec:eco-kb:PDS-V8_0-0051"
        ],
        "rag_doc_refs": [
          "tencent-lke://eco-kb/PDS-V8_0-0051"
        ]
      }
    },
    {
      "item_id": "kg-pub-item:kg-doc-std-GB-14470-2-2002",
      "doc_id": "kg-doc:std-GB-14470-2-2002",
      "title": "兵器工业水污染物排放标准火工药剂(GB 14470.2-2002)",
      "doc_type": "technical_standard",
      "rag_doc_ref": "tencent-lke://eco-kb/PDS-V8_0-0050",
      "source_ref": "tech-spec:eco-kb:PDS-V8_0-0050",
      "legal_basis_status": "internal_reviewed",
      "review_status": "approved",
      "citation_locator": "GB 14470.2-2002",
      "locator_level": "spec_or_section",
      "source_hash": "98216f5b49ee63cc022664bbe27514c13ec7eaa5775efdc437ce7a131983d9be",
      "cache_policy": "metadata_only",
      "raw_cached": false,
      "trace": {
        "source_report": "reports/rag-citation-resolution-report.json",
        "node_ids": [
          "tech-spec:eco-kb:PDS-V8_0-0050"
        ],
        "rag_doc_refs": [
          "tencent-lke://eco-kb/PDS-V8_0-0050"
        ]
      }
    },
    {
      "item_id": "kg-pub-item:kg-doc-std-GB-14470-3-2011",
      "doc_id": "kg-doc:std-GB-14470-3-2011",
      "title": "弹药装药行业水污染物排放标准(GB 14470.3--2011)",
      "doc_type": "technical_standard",
      "rag_doc_ref": "tencent-lke://eco-kb/PDS-V8_0-0078",
      "source_ref": "tech-spec:eco-kb:PDS-V8_0-0078",
      "legal_basis_status": "internal_reviewed",
      "review_status": "approved",
      "citation_locator": "GB 14470.3-2011",
      "locator_level": "spec_or_section",